{
  "$schema": "https://json-schema.org/draft/2020-12/schema",
  "$id": "https://immu4989.github.io/awesome-agentic-usecases/schemas/agent-side-effect-release-binding-receipt-0.6.json",
  "title": "AAU Agent Side-Effect Release Binding Receipt 0.6",
  "type": "object",
  "additionalProperties": false,
  "required": ["receipt_version", "binding_id", "agent_id", "release_id", "status", "aabom_sha256", "plan_sha256", "matrix_manifest_sha256", "matrix_sha256", "matrix_status", "matrix_boundary", "authority_conformance", "consequential_relationship_count", "fully_bound_consequential_relationship_count", "bindings", "findings", "claim_boundary", "receipt_sha256"],
  "properties": {
    "receipt_version": {"const": "aau-agent-side-effect-release-binding-receipt/0.6"},
    "binding_id": {"$ref": "#/$defs/text160"},
    "agent_id": {"$ref": "#/$defs/text160"},
    "release_id": {"$ref": "#/$defs/text160"},
    "status": {"enum": ["evidence_bound", "binding_held"]},
    "aabom_sha256": {"$ref": "#/$defs/digest"},
    "plan_sha256": {"$ref": "#/$defs/digest"},
    "matrix_manifest_sha256": {"$ref": "#/$defs/digest"},
    "matrix_sha256": {"$ref": "#/$defs/digest"},
    "matrix_status": {"enum": ["evidence_passed", "evidence_failed"]},
    "matrix_boundary": {"$ref": "#/$defs/relationship"},
    "authority_conformance": {
      "type": "object",
      "additionalProperties": false,
      "required": ["receipt_version", "status", "adapter_kind", "suite_pack_path", "suite_sha256", "receipt_pack_path", "receipt_sha256", "adapter_source_path", "adapter_receipt_path", "adapter_pack_path", "adapter_sha256", "receipt_adapter_sha256", "adapter_path_matches_receipt", "adapter_bytes_match_receipt", "case_count", "exact_count", "clean_twin_relationship_count", "matrix_relationship_clean_twin_exact"],
      "properties": {
        "receipt_version": {"const": "aau-agent-authority-conformance-receipt/1.2"},
        "status": {"enum": ["evidence_passed", "evidence_failed"]},
        "adapter_kind": {"enum": ["reference", "command"]},
        "suite_pack_path": {"const": "authority/authority-conformance-suite.json"},
        "suite_sha256": {"$ref": "#/$defs/digest"},
        "receipt_pack_path": {"const": "authority/authority-conformance-receipt.json"},
        "receipt_sha256": {"$ref": "#/$defs/digest"},
        "adapter_source_path": {"type": "string", "minLength": 1, "maxLength": 500},
        "adapter_receipt_path": {"type": ["string", "null"], "maxLength": 500},
        "adapter_pack_path": {"const": "authority/authority-adapter.artifact"},
        "adapter_sha256": {"$ref": "#/$defs/digest"},
        "receipt_adapter_sha256": {"oneOf": [{"$ref": "#/$defs/digest"}, {"type": "null"}]},
        "adapter_path_matches_receipt": {"type": "boolean"},
        "adapter_bytes_match_receipt": {"type": "boolean"},
        "case_count": {"type": "integer", "minimum": 1, "maximum": 2000},
        "exact_count": {"type": "integer", "minimum": 0, "maximum": 2000},
        "clean_twin_relationship_count": {"type": "integer", "minimum": 0, "maximum": 2000},
        "matrix_relationship_clean_twin_exact": {"type": "boolean"}
      }
    },
    "consequential_relationship_count": {"type": "integer", "minimum": 0},
    "fully_bound_consequential_relationship_count": {"type": "integer", "minimum": 0},
    "bindings": {
      "type": "array",
      "minItems": 1,
      "maxItems": 50,
      "items": {
        "type": "object",
        "additionalProperties": false,
        "required": ["tool_id", "operation", "resource_scope", "side_effect", "authority_ids", "human_approval_required", "all_adapters_match_matrix", "adapters"],
        "properties": {
          "tool_id": {"type": "string", "minLength": 1, "maxLength": 120},
          "operation": {"$ref": "#/$defs/text160"},
          "resource_scope": {"type": "string", "minLength": 1, "maxLength": 300},
          "side_effect": {"enum": ["read", "prepare", "write", "irreversible"]},
          "authority_ids": {"type": "array", "uniqueItems": true, "items": {"type": "string", "minLength": 1, "maxLength": 120}},
          "human_approval_required": {"type": "boolean"},
          "all_adapters_match_matrix": {"type": "boolean"},
          "adapters": {
            "type": "object",
            "additionalProperties": false,
            "required": ["semantic", "crash", "race"],
            "properties": {
              "semantic": {"$ref": "#/$defs/artifact"},
              "crash": {"$ref": "#/$defs/artifact"},
              "race": {"$ref": "#/$defs/artifact"}
            }
          }
        }
      }
    },
    "findings": {
      "type": "array",
      "items": {
        "type": "object",
        "additionalProperties": false,
        "required": ["code", "subject", "detail"],
        "properties": {
          "code": {"type": "string", "minLength": 1, "maxLength": 120},
          "subject": {"type": "string", "minLength": 1, "maxLength": 300},
          "detail": {"type": "string", "minLength": 1, "maxLength": 500}
        }
      }
    },
    "claim_boundary": {
      "type": "object",
      "additionalProperties": false,
      "required": ["hashes_bind_pack_bytes_not_runtime_identity", "source_paths_are_declarations_not_provenance", "adapter_byte_mismatches_are_binding_holds", "execution_material_mismatches_are_binding_holds", "runtime_material_mismatches_are_binding_holds", "runtime_observation_is_digest_only_and_not_a_sandbox", "static_and_observed_materials_not_complete_runtime_dependency_graph", "exact_resource_scope_is_bound_across_all_three_suites", "authority_decision_adapter_bytes_are_bound", "authority_receipt_not_live_token_or_policy_provenance", "public_synthetic_staging_only", "valid_binding_not_deployment_approval_or_authority", "passing_matrix_not_production_equivalence"],
      "properties": {
        "hashes_bind_pack_bytes_not_runtime_identity": {"const": true},
        "source_paths_are_declarations_not_provenance": {"const": true},
        "adapter_byte_mismatches_are_binding_holds": {"const": true},
        "execution_material_mismatches_are_binding_holds": {"const": true},
        "runtime_material_mismatches_are_binding_holds": {"const": true},
        "runtime_observation_is_digest_only_and_not_a_sandbox": {"const": true},
        "static_and_observed_materials_not_complete_runtime_dependency_graph": {"const": true},
        "exact_resource_scope_is_bound_across_all_three_suites": {"const": true},
        "authority_decision_adapter_bytes_are_bound": {"const": true},
        "authority_receipt_not_live_token_or_policy_provenance": {"const": true},
        "public_synthetic_staging_only": {"const": true},
        "valid_binding_not_deployment_approval_or_authority": {"const": true},
        "passing_matrix_not_production_equivalence": {"const": true}
      }
    },
    "receipt_sha256": {"$ref": "#/$defs/digest"}
  },
  "$defs": {
    "text160": {"type": "string", "minLength": 1, "maxLength": 160},
    "digest": {"type": "string", "pattern": "^[0-9a-f]{64}$"},
    "relationship": {
      "type": "object",
      "additionalProperties": false,
      "required": ["tool_id", "operation", "resource_scope"],
      "properties": {
        "tool_id": {"type": "string", "minLength": 1, "maxLength": 120},
        "operation": {"$ref": "#/$defs/text160"},
        "resource_scope": {"type": "string", "minLength": 1, "maxLength": 300}
      }
    },
    "artifact": {
      "type": "object",
      "additionalProperties": false,
      "required": ["source_path", "pack_path", "size_bytes", "sha256", "matrix_sha256", "materials_pack_path", "material_capture_mode", "material_count", "unresolved_import_count", "material_set_sha256", "matrix_material_set_sha256", "material_set_matches_matrix", "runtime_observation_pack_path", "runtime_capture_mode", "runtime_session_count", "runtime_material_count", "runtime_only_material_count", "runtime_capabilities", "runtime_observation_sha256", "runtime_snapshot_pack_path", "runtime_snapshot_sha256", "runtime_materials_match_matrix", "matches_matrix"],
      "properties": {
        "source_path": {"type": "string", "minLength": 1, "maxLength": 500},
        "pack_path": {"type": "string", "minLength": 1, "maxLength": 500},
        "size_bytes": {"type": "integer", "minimum": 1, "maximum": 2000000},
        "sha256": {"$ref": "#/$defs/digest"},
        "matrix_sha256": {"$ref": "#/$defs/digest"},
        "materials_pack_path": {"type": "string", "minLength": 1, "maxLength": 500},
        "material_capture_mode": {"enum": ["static_local_python_imports", "entrypoint_only_non_python"]},
        "material_count": {"type": "integer", "minimum": 1, "maximum": 200},
        "unresolved_import_count": {"type": "integer", "minimum": 0, "maximum": 200},
        "material_set_sha256": {"$ref": "#/$defs/digest"},
        "matrix_material_set_sha256": {"$ref": "#/$defs/digest"},
        "material_set_matches_matrix": {"type": "boolean"},
        "runtime_observation_pack_path": {"type": "string", "minLength": 1, "maxLength": 500},
        "runtime_capture_mode": {"enum": ["cpython_audit_workspace_reads", "not_observed_non_python"]},
        "runtime_session_count": {"type": "integer", "minimum": 0, "maximum": 250},
        "runtime_material_count": {"type": "integer", "minimum": 0, "maximum": 200},
        "runtime_only_material_count": {"type": "integer", "minimum": 0, "maximum": 200},
        "runtime_capabilities": {
          "type": "array",
          "uniqueItems": true,
          "items": {"enum": ["dynamic_code", "native_or_extension_load", "network", "runtime_instrumentation_change", "subprocess"]}
        },
        "runtime_observation_sha256": {"$ref": "#/$defs/digest"},
        "runtime_snapshot_pack_path": {"type": "string", "minLength": 1, "maxLength": 500},
        "runtime_snapshot_sha256": {"$ref": "#/$defs/digest"},
        "runtime_materials_match_matrix": {"type": "boolean"},
        "matches_matrix": {"type": "boolean"}
      }
    }
  }
}
