{
  "receipt_version": "aau-agent-side-effect-release-binding-receipt/0.6",
  "binding_id": "synthetic-benefit-coordinator-side-effect-release-0.1.0",
  "agent_id": "agent:benefit-coordinator",
  "release_id": "synthetic-benefit-coordinator-0.1.0",
  "status": "evidence_bound",
  "aabom_sha256": "0fc50040c74f2385206ca796fa5dd2e64daaa216fadff4a24e264840b74f7d16",
  "plan_sha256": "a6a78532f3865cdbbc77a5b7eb8cfaabb9fad7839a93684cae8c8d65f7048c1f",
  "matrix_manifest_sha256": "a25cd869058756a733c9d6d83f30047bbf4ee7c6f10d0065412843cade147212",
  "matrix_sha256": "4726eeacb94abc4b6c5f8bfe923abdce16211521cccf057d3d21e48287a98481",
  "matrix_status": "evidence_passed",
  "matrix_boundary": {
    "tool_id": "notification-service",
    "operation": "send_synthetic_notice",
    "resource_scope": "synthetic-benefit-cases/notices/*"
  },
  "authority_conformance": {
    "receipt_version": "aau-agent-authority-conformance-receipt/1.2",
    "status": "evidence_passed",
    "adapter_kind": "command",
    "suite_pack_path": "authority/authority-conformance-suite.json",
    "suite_sha256": "c79691d667fbb89d9074f304e2b6989d91f4badef5fbc967881827012a652246",
    "receipt_pack_path": "authority/authority-conformance-receipt.json",
    "receipt_sha256": "e2798a53238fdc70e335f00762b7a85df3daff27472a976faea00da6c6d6b5ed",
    "adapter_source_path": "agent-side-effect-ledger/examples/release-binding/reference_authority_adapter.py",
    "adapter_receipt_path": "agent-side-effect-ledger/examples/release-binding/reference_authority_adapter.py",
    "adapter_pack_path": "authority/authority-adapter.artifact",
    "adapter_sha256": "6a3e062a688a2c9620c33eaa93e562f771d5ffbd59d8e984a91d849faa3dc57b",
    "receipt_adapter_sha256": "6a3e062a688a2c9620c33eaa93e562f771d5ffbd59d8e984a91d849faa3dc57b",
    "adapter_path_matches_receipt": true,
    "adapter_bytes_match_receipt": true,
    "case_count": 8,
    "exact_count": 8,
    "clean_twin_relationship_count": 1,
    "matrix_relationship_clean_twin_exact": true
  },
  "consequential_relationship_count": 1,
  "fully_bound_consequential_relationship_count": 1,
  "bindings": [
    {
      "tool_id": "notification-service",
      "operation": "send_synthetic_notice",
      "resource_scope": "synthetic-benefit-cases/notices/*",
      "side_effect": "write",
      "authority_ids": [
        "synthetic-notice-write-lease"
      ],
      "human_approval_required": true,
      "all_adapters_match_matrix": true,
      "adapters": {
        "semantic": {
          "source_path": "agent-side-effect-ledger/examples/reference_adapter.py",
          "pack_path": "adapters/001-semantic.artifact",
          "size_bytes": 1658,
          "sha256": "f3bc78226a2a701e7f7b5b3d1fc9e1bc593bb746184e0552758a3c91b7bf46cf",
          "matrix_sha256": "f3bc78226a2a701e7f7b5b3d1fc9e1bc593bb746184e0552758a3c91b7bf46cf",
          "materials_pack_path": "adapters/001-semantic.materials.json",
          "material_capture_mode": "static_local_python_imports",
          "material_count": 2,
          "unresolved_import_count": 12,
          "material_set_sha256": "32cfd35cecaaed253ba3033a3f9b51f858da4c8f892e081b6afa54381aa0fadc",
          "matrix_material_set_sha256": "32cfd35cecaaed253ba3033a3f9b51f858da4c8f892e081b6afa54381aa0fadc",
          "material_set_matches_matrix": true,
          "runtime_observation_pack_path": "matrix/semantic-adapter.observation.json",
          "runtime_capture_mode": "cpython_audit_workspace_reads",
          "runtime_session_count": 12,
          "runtime_material_count": 3,
          "runtime_only_material_count": 1,
          "runtime_capabilities": [
            "dynamic_code"
          ],
          "runtime_observation_sha256": "73bf3e5f55b007b729d5533f66ff5d114b720a121539997e6f1af1ff529ab3e8",
          "runtime_snapshot_pack_path": "adapters/001-semantic.runtime-snapshot.json",
          "runtime_snapshot_sha256": "1404e1a003a5004a1a1534d080bd0ca7c840a6996433176d020a49bd02ebc0fe",
          "runtime_materials_match_matrix": true,
          "matches_matrix": true
        },
        "crash": {
          "source_path": "agent-side-effect-ledger/examples/reference_crash_adapter.py",
          "pack_path": "adapters/001-crash.artifact",
          "size_bytes": 7332,
          "sha256": "7a17dd8f7a2c37b387e6375fc67f681314b4f1b47843bb0f172d97e7cc6e4cb1",
          "matrix_sha256": "7a17dd8f7a2c37b387e6375fc67f681314b4f1b47843bb0f172d97e7cc6e4cb1",
          "materials_pack_path": "adapters/001-crash.materials.json",
          "material_capture_mode": "static_local_python_imports",
          "material_count": 3,
          "unresolved_import_count": 14,
          "material_set_sha256": "3a03d01ce7a713d30ef7efe8954421e93399f66911d55ee94e003ab9f6c09054",
          "matrix_material_set_sha256": "3a03d01ce7a713d30ef7efe8954421e93399f66911d55ee94e003ab9f6c09054",
          "material_set_matches_matrix": true,
          "runtime_observation_pack_path": "matrix/crash-adapter.observation.json",
          "runtime_capture_mode": "cpython_audit_workspace_reads",
          "runtime_session_count": 24,
          "runtime_material_count": 4,
          "runtime_only_material_count": 1,
          "runtime_capabilities": [
            "dynamic_code"
          ],
          "runtime_observation_sha256": "5249b8e74018300c71fe13ff923426fd32ad8f0cab17c6ad32ff91f3cf3d73d2",
          "runtime_snapshot_pack_path": "adapters/001-crash.runtime-snapshot.json",
          "runtime_snapshot_sha256": "be674d97589495811ebe9011a6f4e6951cf7a270ed7905ed6df370b81145d0a3",
          "runtime_materials_match_matrix": true,
          "matches_matrix": true
        },
        "race": {
          "source_path": "agent-side-effect-ledger/examples/reference_race_adapter.py",
          "pack_path": "adapters/001-race.artifact",
          "size_bytes": 4525,
          "sha256": "cd0ee65036f7be60e819c0dc4e34af8d337834ecd587994ca7918d318e2e62e9",
          "matrix_sha256": "cd0ee65036f7be60e819c0dc4e34af8d337834ecd587994ca7918d318e2e62e9",
          "materials_pack_path": "adapters/001-race.materials.json",
          "material_capture_mode": "static_local_python_imports",
          "material_count": 3,
          "unresolved_import_count": 16,
          "material_set_sha256": "961aa8f083cea39a95f722e6885543592a71fc5fdb25b0587c4a0e30110221f3",
          "matrix_material_set_sha256": "961aa8f083cea39a95f722e6885543592a71fc5fdb25b0587c4a0e30110221f3",
          "material_set_matches_matrix": true,
          "runtime_observation_pack_path": "matrix/race-adapter.observation.json",
          "runtime_capture_mode": "cpython_audit_workspace_reads",
          "runtime_session_count": 73,
          "runtime_material_count": 4,
          "runtime_only_material_count": 1,
          "runtime_capabilities": [
            "dynamic_code"
          ],
          "runtime_observation_sha256": "0bc925219cd9dfbc6d8ca1f44718549085cecc95ea74306f93cada243d3ca75c",
          "runtime_snapshot_pack_path": "adapters/001-race.runtime-snapshot.json",
          "runtime_snapshot_sha256": "bed2e7a4db884ba4f0b8c55570b2b0381ebd7cb0d31be82e22c47cdec201a0dc",
          "runtime_materials_match_matrix": true,
          "matches_matrix": true
        }
      }
    }
  ],
  "findings": [],
  "claim_boundary": {
    "hashes_bind_pack_bytes_not_runtime_identity": true,
    "source_paths_are_declarations_not_provenance": true,
    "adapter_byte_mismatches_are_binding_holds": true,
    "execution_material_mismatches_are_binding_holds": true,
    "runtime_material_mismatches_are_binding_holds": true,
    "runtime_observation_is_digest_only_and_not_a_sandbox": true,
    "static_and_observed_materials_not_complete_runtime_dependency_graph": true,
    "exact_resource_scope_is_bound_across_all_three_suites": true,
    "authority_decision_adapter_bytes_are_bound": true,
    "authority_receipt_not_live_token_or_policy_provenance": true,
    "public_synthetic_staging_only": true,
    "valid_binding_not_deployment_approval_or_authority": true,
    "passing_matrix_not_production_equivalence": true
  },
  "receipt_sha256": "3b834331f1b97aa6ce3148e866f0d9462ac94748346bf0c5875de69fd50d8bf0"
}
